{
  "schemaVersion": 2,
  "slug": "empty-state",
  "name": "Empty State",
  "sourceKind": "structured-spec",
  "confidence": "high",
  "semanticTypeCandidates": [
    "feedback-overlay",
    "zero-content",
    "absence-state"
  ],
  "variantDimensions": {
    "variant": [
      "first-use",
      "no-results",
      "no-data"
    ]
  },
  "representativeVariants": [
    {
      "variant": "first-use",
      "title": "还没有任务",
      "supporting": "创建第一个任务后，它会出现在这里。",
      "action": "新建任务"
    },
    {
      "variant": "no-data",
      "title": "暂无内容",
      "supporting": "当前还没有可展示的内容。"
    },
    {
      "variant": "no-results",
      "title": "未找到相关结果",
      "supporting": "没有符合当前关键词和筛选条件的结果。",
      "action": "调整筛选"
    }
  ],
  "anatomy": [
    "container",
    "visual?",
    "title",
    "supportingText",
    "primaryAction?",
    "secondaryAction?"
  ],
  "traits": {
    "titleFont": "var(--type-heading)",
    "supportingFont": "var(--type-body-small)",
    "titleColor": "var(--color-text-primary)",
    "supportingColor": "var(--color-text-secondary)",
    "gap": "var(--space-8)",
    "maxWidth": "280px",
    "visualSize": "64px",
    "visualColor": "var(--color-text-tertiary)"
  },
  "structurePatterns": [
    "centered vertical column: optional neutral visual, title, supporting text, actions",
    "visual is optional and remains neutral/subtle; Empty State does not use Success/Danger decoration to imply an outcome",
    "at most one visually primary action; optional secondary text action",
    "no-results keeps current query/filter context visible or recoverable and offers a way to broaden or clear constraints"
  ],
  "usageHints": [
    "use only for absence: first-use, no-data, or no-results",
    "copy explains why content is absent and the next useful action when one exists",
    "no-results is contextual to the active query/filter state, not a global product empty state",
    "recoverable failure belongs to Result/Blocking/Alert semantics, not Empty State",
    "one primary action maximum"
  ],
  "doNotInvent": [
    "no recoverable-error variant in new V2 designs",
    "no Success/Danger color as default empty decoration",
    "no oversized branded illustration",
    "no multiple competing primary actions"
  ],
  "unknowns": []
}
