{
  "schemaVersion": 2,
  "slug": "bottom-navigation",
  "name": "Bottom Navigation",
  "sourceKind": "structured-spec",
  "confidence": "high",
  "semanticTypeCandidates": [
    "navigation-information",
    "top-level-destination",
    "tab-bar"
  ],
  "variantDimensions": {
    "state": [
      "active",
      "inactive",
      "pressed"
    ],
    "badge": [
      "none",
      "dot",
      "count"
    ]
  },
  "representativeVariants": [
    {
      "label": "首页",
      "active": true,
      "icon": "core.home"
    },
    {
      "label": "工作台",
      "active": false,
      "icon": "core.menu"
    },
    {
      "label": "设置",
      "active": false,
      "icon": "core.settings",
      "badge": "count",
      "count": "8"
    },
    {
      "label": "我的",
      "active": false,
      "icon": "core.user",
      "badge": "dot"
    }
  ],
  "anatomy": [
    "container",
    "destinationItem",
    "icon",
    "label",
    "badge?"
  ],
  "traits": {
    "contentMinHeight": "56px",
    "iconSize": "var(--size-icon-lg)",
    "background": "var(--color-surface)",
    "topDivider": "1px solid var(--color-border-subtle)",
    "labelFont": "var(--type-label-small)",
    "activeColor": "var(--color-text-brand)",
    "inactiveColor": "var(--color-text-tertiary)",
    "pressedBackground": "var(--color-surface-pressed)",
    "itemGap": "4px",
    "badgeDotSize": "8px",
    "badgeCountMinSize": "18px",
    "badgeBackground": "var(--color-danger)",
    "badgeColor": "var(--color-text-inverse)",
    "navigationFoundationRef": "sources.navigationFoundation.responsiveMapping.compact",
    "iconSource": "sources.iconography"
  },
  "structurePatterns": [
    "horizontal flex container, each destination is a vertical flex (icon over label)",
    "3 to 5 destinations distributed with equal width",
    "count badge shows 1-99, then 99+; dot badge for unread without count",
    "container has a top hairline divider; platform safe area is owned by the platform layer"
  ],
  "usageHints": [
    "Brand (Electric Indigo) is the active identity; Accent Cyan is reserved for local emphasis",
    "labels stay visible and single-line in V1",
    "badge must not obscure the icon silhouette",
    "56px is the content band excluding safe area"
  ],
  "doNotInvent": [
    "no floating pill navigation as the V1 default",
    "no default shadow (hairline divider is the boundary)",
    "no accent-cyan active state"
  ],
  "unknowns": [
    "haptic/animation selection timing defined by motion contract, not visualized here"
  ],
  "interactionContract": [
    "represents direct navigation among 3–5 stable top-level destinations only",
    "active destination is authoritative navigation state and is separate from pressed/transient feedback",
    "deep or numerous destinations move to Drawer/Sheet multi-level navigation rather than expanding Bottom Navigation hierarchy"
  ],
  "keyboardContract": [
    "when keyboard input is available, every destination remains reachable in semantic destination order",
    "focus-visible treatment follows T012 input policy"
  ],
  "accessibilityContract": [
    "active destination exposes current-page/current-destination semantics without relying on color alone",
    "every icon has a visible label in the default Bottom Navigation presentation",
    "badges supplement rather than replace destination labels"
  ],
  "platformPresentationRefs": [
    {
      "ref": "sources.navigationFoundation.responsiveMapping.compact",
      "context": "compact",
      "note": "Preferred for 3–5 stable top-level destinations; not a generic deep-navigation container."
    }
  ]
}
